{
  "$schema": "https://json-schema.org/draft/2020-12/schema",
  "$id": "https://raw.githubusercontent.com/nkaique21/2D-MMO-Launcher-Catalog/main/schemas/catalog.schema.json",
  "title": "2D MMO Launcher Catalog",
  "type": "object",
  "additionalProperties": false,
  "required": ["schemaVersion", "catalogVersion", "generatedAt", "games"],
  "properties": {
    "schemaVersion": { "type": "integer", "const": 1 },
    "catalogVersion": { "type": "string", "minLength": 1 },
    "generatedAt": { "type": "string", "format": "date-time" },
    "games": {
      "type": "array",
      "maxItems": 500,
      "items": {
        "type": "object",
        "additionalProperties": false,
        "required": ["id", "manifest", "enabled"],
        "properties": {
          "id": { "type": "string", "pattern": "^[a-z0-9][a-z0-9_-]{0,79}$" },
          "manifest": { "type": "string", "pattern": "^manifests/[a-z0-9][a-z0-9_-]*\\.json$" },
          "enabled": { "type": "boolean" }
        }
      }
    }
  }
}
