{
  "schemaVersion": 1,
  "catalogVersion": "0.1.0",
  "generatedAt": "2026-07-23T00:00:00Z",
  "games": [
    {
      "id": "archlight",
      "manifest": "manifests/archlight.json",
      "enabled": true
    },
    {
      "id": "grand-line-adventures",
      "manifest": "manifests/grand-line-adventures.json",
      "enabled": true
    },
    {
      "id": "medivia",
      "manifest": "manifests/medivia.json",
      "enabled": true
    },
    {
      "id": "pokemmo",
      "manifest": "manifests/pokemmo.json",
      "enabled": true
    },
    {
      "id": "pokexgames",
      "manifest": "manifests/pokexgames.json",
      "enabled": true
    },
    {
      "id": "ravenquest",
      "manifest": "manifests/ravenquest.json",
      "enabled": true
    },
    {
      "id": "stendhal",
      "manifest": "manifests/stendhal.json",
      "enabled": true
    },
    {
      "id": "mirage-realms",
      "manifest": "manifests/mirage-realms.json",
      "enabled": true
    },
    {
      "id": "world-of-tolkien",
      "manifest": "manifests/world-of-tolkien.json",
      "enabled": true
    },
    {
      "id": "endless-online",
      "manifest": "manifests/endless-online.json",
      "enabled": true
    }
  ]
}
